{
  "schema_version": "1.0",
  "last_reviewed": "2026-05-02",
  "intent": "Turn SecurityRecipes from a prose recipe catalog into an enterprise control plane for agentic remediation: every workflow has declared scope, MCP context, deterministic gates, audit evidence, KPIs, and kill signals that agents and reviewers can consume directly.",
  "required_gate_phases": [
    "admission",
    "tool_call",
    "output",
    "pre_merge",
    "post_merge",
    "runtime"
  ],
  "standards_alignment": [
    {
      "id": "nist-ai-rmf",
      "name": "NIST AI Risk Management Framework",
      "url": "https://www.nist.gov/itl/ai-risk-management-framework",
      "why_it_matters": "Frames agentic remediation as governed, mapped, measured, and managed AI risk instead of ad hoc automation."
    },
    {
      "id": "nist-ssdf-800-218",
      "name": "NIST SP 800-218 Secure Software Development Framework",
      "url": "https://csrc.nist.gov/pubs/sp/800/218/final",
      "why_it_matters": "Connects remediation automation to secure software development practices and vulnerability-response evidence."
    },
    {
      "id": "cisa-secure-by-design",
      "name": "CISA Secure by Design",
      "url": "https://www.cisa.gov/securebydesign",
      "why_it_matters": "Anchors the product in measurable customer security outcomes, transparency, and executive ownership."
    },
    {
      "id": "owasp-genai",
      "name": "OWASP GenAI Security Project and LLM Top 10",
      "url": "https://owasp.org/www-project-top-10-for-large-language-model-applications",
      "why_it_matters": "Covers prompt injection, excessive agency, insecure plugin/tool design, overreliance, and sensitive information disclosure."
    },
    {
      "id": "mcp-security",
      "name": "Model Context Protocol Security Best Practices",
      "url": "https://modelcontextprotocol.io/specification/2025-06-18/basic/security_best_practices",
      "why_it_matters": "Grounds MCP tool access in authorization, confused-deputy prevention, scoped tool calls, and auditability."
    }
  ],
  "workflow_defaults": {
    "branch_prefix": "sec-auto-remediation/",
    "required_pr_label": "sec-auto-remediation",
    "human_review_required": true,
    "default_change_window": "business-hours-local",
    "max_open_prs_per_repo": 3,
    "evidence_retention_days": 400,
    "manual_review_required_for": [
      "secrets or key material",
      "CI and deployment configuration",
      "MCP client or server configuration",
      "prompt, skill, or rules-file changes",
      "database migrations",
      "production infrastructure"
    ]
  },
  "workflows": [
    {
      "id": "sensitive-data-remediation",
      "title": "Sensitive Data Element Remediation",
      "status": "active",
      "maturity_stage": "walk",
      "content_path": "content/security-remediation/sensitive-data/_index.md",
      "public_path": "/security-remediation/sensitive-data/",
      "owner": {
        "accountable_team": "Security Engineering",
        "reviewer_pools": [
          "security-remediation",
          "service-owner"
        ],
        "escalation": "privacy-security"
      },
      "eligible_findings": [
        "scanner-confirmed PII, PHI, PCI, token, or secret exposure in source, tests, fixtures, schemas, logs, or shared configuration",
        "single-service redaction or relocation where the data class and destination are known"
      ],
      "default_agents": [
        "codex",
        "claude",
        "cursor",
        "github_copilot",
        "devin"
      ],
      "automation_first": [
        "gitleaks",
        "trufflehog",
        "detect-secrets",
        "earlybird",
        "presidio"
      ],
      "mcp_context": [
        {
          "namespace": "findings.sde",
          "access": "read",
          "purpose": "Read scanner finding metadata and data classification."
        },
        {
          "namespace": "repo.contents",
          "access": "write_branch",
          "purpose": "Patch scoped files on a remediation branch only."
        },
        {
          "namespace": "tickets.security",
          "access": "write_ticket",
          "purpose": "Open triage tickets when data ownership or redaction rules are unclear."
        }
      ],
      "scope": {
        "allowed_paths": [
          "src/**",
          "app/**",
          "config/**",
          "schemas/**",
          "test/**",
          "tests/**",
          "fixtures/**"
        ],
        "forbidden_paths": [
          ".github/**",
          "infra/**",
          "deploy/**",
          "migrations/**",
          "**/*.pem",
          "**/*.key"
        ],
        "max_changed_files": 8,
        "max_diff_lines": 250
      },
      "gates": {
        "admission": [
          "finding has deterministic scanner ID and data class",
          "CODEOWNERS resolves to an owning team",
          "repo has sec-auto-remediation opt-in marker"
        ],
        "tool_call": [
          "repo writes restricted to remediation branch prefix",
          "ticket writes limited to security triage project",
          "no access to secret stores or production credentials"
        ],
        "output": [
          "original scanner finding is gone",
          "no new high-severity scanner finding appears",
          "PR body includes data class, redaction shape, and rollback notes"
        ],
        "pre_merge": [
          "security reviewer and owning-team reviewer approve",
          "manual-review-required classes have zero auto-approval",
          "CI and scanner re-run are green on current base"
        ],
        "post_merge": [
          "finding closes or is marked mitigated",
          "deployment canary observes error-rate and log-volume monitors"
        ],
        "runtime": [
          "agent session disablement triggers on scope creep or secret-access attempt",
          "egress restricted to scanner, source, and ticket hosts"
        ]
      },
      "evidence": [
        {
          "id": "sde-scanner-before-after",
          "source": "scanner SARIF or JSON",
          "retention": "400d",
          "evidence_owner": "Security Engineering"
        },
        {
          "id": "sde-pr-review-record",
          "source": "source host review events",
          "retention": "400d",
          "evidence_owner": "Engineering Platform"
        },
        {
          "id": "sde-agent-tool-audit",
          "source": "MCP gateway audit log",
          "retention": "400d",
          "evidence_owner": "AI Platform"
        }
      ],
      "kpis": [
        {
          "id": "mttr_p50",
          "target": "<= 30% of manual baseline"
        },
        {
          "id": "merge_as_is_rate",
          "target": ">= 70% once mature"
        },
        {
          "id": "regression_rate",
          "target": "<= 1% rolling 30d"
        }
      ],
      "kill_signals": [
        "any unapproved secret or credential access attempt",
        "regression rate exceeds 3% over 14 days",
        "auto-approval on manual-review-required change class"
      ]
    },
    {
      "id": "vulnerable-dependency-remediation",
      "title": "Vulnerable Dependency Remediation",
      "status": "active",
      "maturity_stage": "walk",
      "content_path": "content/security-remediation/vulnerable-dependencies/_index.md",
      "public_path": "/security-remediation/vulnerable-dependencies/",
      "owner": {
        "accountable_team": "Product Security",
        "reviewer_pools": [
          "dependency-remediation",
          "service-owner"
        ],
        "escalation": "supply-chain-security"
      },
      "eligible_findings": [
        "reachable vulnerable dependency with a compatible fixed version",
        "lockfile-only or bounded manifest plus compatibility edit",
        "known CVE or advisory with package, ecosystem, and affected range"
      ],
      "default_agents": [
        "codex",
        "claude",
        "cursor",
        "github_copilot",
        "devin"
      ],
      "automation_first": [
        "dependabot",
        "renovate",
        "npm audit fix",
        "pip-audit --fix",
        "go get",
        "cargo update",
        "osv-scanner"
      ],
      "mcp_context": [
        {
          "namespace": "advisories.vulnerability",
          "access": "read",
          "purpose": "Read advisory ranges, severity, EPSS, and known-exploited status."
        },
        {
          "namespace": "sbom.inventory",
          "access": "read",
          "purpose": "Locate affected manifests, images, packages, and owners."
        },
        {
          "namespace": "repo.contents",
          "access": "write_branch",
          "purpose": "Patch manifests and lockfiles on remediation branch only."
        }
      ],
      "scope": {
        "allowed_paths": [
          "package.json",
          "package-lock.json",
          "pnpm-lock.yaml",
          "yarn.lock",
          "requirements*.txt",
          "pyproject.toml",
          "poetry.lock",
          "uv.lock",
          "go.mod",
          "go.sum",
          "Cargo.toml",
          "Cargo.lock",
          "Gemfile",
          "Gemfile.lock"
        ],
        "forbidden_paths": [
          ".github/**",
          "infra/**",
          "deploy/**",
          "migrations/**"
        ],
        "max_changed_files": 6,
        "max_diff_lines": 600
      },
      "gates": {
        "admission": [
          "fixed version exists or mitigation recipe is present",
          "package ecosystem is supported by deterministic resolver",
          "open remediation PR cap has not been reached"
        ],
        "tool_call": [
          "resolver commands restricted to declared ecosystem",
          "repo writes restricted to package manifest and lockfile scope",
          "no registry publish or release action permitted"
        ],
        "output": [
          "scanner confirms vulnerable package range is removed",